{
  "title": "A JSON Schema for Swagger 2.0 API.",
  "id": "http://swagger.io/v2/schema.json#",
  "$schema": "http://json-schema.org/draft-04/schema#",
  "type": "object",
  "required": [
    "swagger",
    "info",
    "paths"
  ],
  "additionalProperties": false,
  "patternProperties": {
    "^x-": {
      "$ref": "#/definitions/vendorExtension"
    }
  },
  "properties": {
    "swagger": {
      "type": "string",
      "enum": [
        "2.0"
      ],
      "description": "The Swagger version of this document."
    },
    "info": {
      "$ref": "#/definitions/info"
    },
    "host": {
      "type": "string",
      "pattern": "^[^{}/ :\\\\]+(?::\\d+)?$",
      "description": "The host (name or ip) of the API. Example: 'swagger.io'"
    },
    "basePath": {
      "type": "string",
      "pattern": "^/",
      "description": "The base path to the API. Example: '/api'."
    },
    "schemes": {
      "$ref": "#/definitions/schemesList"
    },
    "consumes": {
      "description": "A list of MIME types accepted by the API.",
      "allOf": [
        {
          "$ref": "#/definitions/mediaTypeList"
        }
      ]
    },
    "produces": {
      "description": "A list of MIME types the API can produce.",
      "allOf": [
        {
          "$ref": "#/definitions/mediaTypeList"
        }
      ]
    },
    "paths": {
      "$ref": "#/definitions/paths"
    },
    "definitions": {
      "$ref": "#/definitions/definitions"
    },
    "parameters": {
      "$ref": "#/definitions/parameterDefinitions"
    },
    "responses": {
      "$ref": "#/definitions/responseDefinitions"
    },
    "security": {
      "$ref": "#/definitions/security"
    },
    "securityDefinitions": {
      "$ref": "#/definitions/securityDefinitions"
    },
    "tags": {
      "type": "array",
      "items": {
        "$ref": "#/definitions/tag"
      },
      "uniqueItems": true
    },
    "externalDocs": {
      "$ref": "#/definitions/externalDocs"
    }
  }
}